{
  "schema_version": "1.0.0",
  "corpus_id": "enam-2026.1-tipo1",
  "evidence_kind": "official",
  "edition": "ENAM 2026.1 — Tipo 1",
  "exam_type": "enam",
  "date": "2026-06-07",
  "expected_questions": 80,
  "official_source": {
    "url": "https://conhecimento.fgv.br/sites/default/files/concursos/magistratura-cns001-tipo-1.pdf",
    "sha256": "31a6228c7f2ec52358fffb1f6add267ed075ead17d5c3ad37a500d465d084aa4",
    "accessed_at": "2026-10-03"
  },
  "document_review": {
    "reviewer": "Codex — verificação automatizada documental",
    "date": "2026-10-03",
    "note": "URLs vinculadas pela página oficial FGV; bytes PDF baixados e hashes calculados; capa/tipo/data/80 itens e gabarito definitivo conferidos. Extração automatizada não é revisão jurídica humana."
  },
  "answer_key": {
    "status": "definitivo",
    "url": "https://conhecimento.fgv.br/sites/default/files/concursos/enam-exame-nacional-de-magistratura-2026.1.pdf",
    "sha256": "81c1cbfbcab8df8d6ba0cd2f1ac2950b16cefe6147ed6490af8799b14dbfbba7"
  },
  "questions": [
    {
      "id": "1",
      "status": "valida",
      "reviews": [
        {
          "id": "draft-1",
          "reviewer": "Codex — rascunho automatizado, não humano",
          "date": "2026-10-03",
          "note": "Página 3, coluna 1. Formato por heurística; disciplina por cabeçalho. Origem do ponto/dificuldade e classificação final aguardam revisão humana, portanto item não elegível.",
          "format": "direto",
          "discipline": "Direito Constitucional",
          "point_source": null
        }
      ]
    },
    {
      "id": "2",
      "status": "valida",
      "reviews": [
        {
          "id": "draft-2",
          "reviewer": "Codex — rascunho automatizado, não humano",
          "date": "2026-10-03",
          "note": "Página 3, coluna 1. Formato por heurística; disciplina por cabeçalho. Origem do ponto/dificuldade e classificação final aguardam revisão humana, portanto item não elegível.",
          "format": "direto",
          "discipline": "Direito Constitucional",
          "point_source": null
        }
      ]
    },
    {
      "id": "3",
      "status": "valida",
      "reviews": [
        {
          "id": "draft-3",
          "reviewer": "Codex — rascunho automatizado, não humano",
          "date": "2026-10-03",
          "note": "Página 3, coluna 2. Formato por heurística; disciplina por cabeçalho. Origem do ponto/dificuldade e classificação final aguardam revisão humana, portanto item não elegível.",
          "format": "direto",
          "discipline": "Direito Constitucional",
          "point_source": null
        }
      ]
    },
    {
      "id": "4",
      "status": "valida",
      "reviews": [
        {
          "id": "draft-4",
          "reviewer": "Codex — rascunho automatizado, não humano",
          "date": "2026-10-03",
          "note": "Página 3, coluna 2. Formato por heurística; disciplina por cabeçalho. Origem do ponto/dificuldade e classificação final aguardam revisão humana, portanto item não elegível.",
          "format": "numerado",
          "discipline": "Direito Constitucional",
          "point_source": null
        }
      ]
    },
    {
      "id": "5",
      "status": "valida",
      "reviews": [
        {
          "id": "draft-5",
          "reviewer": "Codex — rascunho automatizado, não humano",
          "date": "2026-10-03",
          "note": "Página 4, coluna 1. Formato por heurística; disciplina por cabeçalho. Origem do ponto/dificuldade e classificação final aguardam revisão humana, portanto item não elegível.",
          "format": "direto",
          "discipline": "Direito Constitucional",
          "point_source": null
        }
      ]
    },
    {
      "id": "6",
      "status": "valida",
      "reviews": [
        {
          "id": "draft-6",
          "reviewer": "Codex — rascunho automatizado, não humano",
          "date": "2026-10-03",
          "note": "Página 4, coluna 2. Formato por heurística; disciplina por cabeçalho. Origem do ponto/dificuldade e classificação final aguardam revisão humana, portanto item não elegível.",
          "format": "numerado",
          "discipline": "Direito Constitucional",
          "point_source": null
        }
      ]
    },
    {
      "id": "7",
      "status": "valida",
      "reviews": [
        {
          "id": "draft-7",
          "reviewer": "Codex — rascunho automatizado, não humano",
          "date": "2026-10-03",
          "note": "Página 4, coluna 2. Formato por heurística; disciplina por cabeçalho. Origem do ponto/dificuldade e classificação final aguardam revisão humana, portanto item não elegível.",
          "format": "direto",
          "discipline": "Direito Constitucional",
          "point_source": null
        }
      ]
    },
    {
      "id": "8",
      "status": "valida",
      "reviews": [
        {
          "id": "draft-8",
          "reviewer": "Codex — rascunho automatizado, não humano",
          "date": "2026-10-03",
          "note": "Página 5, coluna 1. Formato por heurística; disciplina por cabeçalho. Origem do ponto/dificuldade e classificação final aguardam revisão humana, portanto item não elegível.",
          "format": "numerado",
          "discipline": "Direito Constitucional",
          "point_source": null
        }
      ]
    },
    {
      "id": "9",
      "status": "valida",
      "reviews": [
        {
          "id": "draft-9",
          "reviewer": "Codex — rascunho automatizado, não humano",
          "date": "2026-10-03",
          "note": "Página 5, coluna 1. Formato por heurística; disciplina por cabeçalho. Origem do ponto/dificuldade e classificação final aguardam revisão humana, portanto item não elegível.",
          "format": "numerado",
          "discipline": "Direito Constitucional",
          "point_source": null
        }
      ]
    },
    {
      "id": "10",
      "status": "valida",
      "reviews": [
        {
          "id": "draft-10",
          "reviewer": "Codex — rascunho automatizado, não humano",
          "date": "2026-10-03",
          "note": "Página 5, coluna 2. Formato por heurística; disciplina por cabeçalho. Origem do ponto/dificuldade e classificação final aguardam revisão humana, portanto item não elegível.",
          "format": "numerado",
          "discipline": "Direito Constitucional",
          "point_source": null
        }
      ]
    },
    {
      "id": "11",
      "status": "valida",
      "reviews": [
        {
          "id": "draft-11",
          "reviewer": "Codex — rascunho automatizado, não humano",
          "date": "2026-10-03",
          "note": "Página 5, coluna 2. Formato por heurística; disciplina por cabeçalho. Origem do ponto/dificuldade e classificação final aguardam revisão humana, portanto item não elegível.",
          "format": "direto",
          "discipline": "Direito Constitucional",
          "point_source": null
        }
      ]
    },
    {
      "id": "12",
      "status": "valida",
      "reviews": [
        {
          "id": "draft-12",
          "reviewer": "Codex — rascunho automatizado, não humano",
          "date": "2026-10-03",
          "note": "Página 6, coluna 1. Formato por heurística; disciplina por cabeçalho. Origem do ponto/dificuldade e classificação final aguardam revisão humana, portanto item não elegível.",
          "format": "numerado",
          "discipline": "Direito Constitucional",
          "point_source": null
        }
      ]
    },
    {
      "id": "13",
      "status": "valida",
      "reviews": [
        {
          "id": "draft-13",
          "reviewer": "Codex — rascunho automatizado, não humano",
          "date": "2026-10-03",
          "note": "Página 6, coluna 2. Formato por heurística; disciplina por cabeçalho. Origem do ponto/dificuldade e classificação final aguardam revisão humana, portanto item não elegível.",
          "format": "direto",
          "discipline": "Direito Constitucional",
          "point_source": null
        }
      ]
    },
    {
      "id": "14",
      "status": "valida",
      "reviews": [
        {
          "id": "draft-14",
          "reviewer": "Codex — rascunho automatizado, não humano",
          "date": "2026-10-03",
          "note": "Página 7, coluna 1. Formato por heurística; disciplina por cabeçalho. Origem do ponto/dificuldade e classificação final aguardam revisão humana, portanto item não elegível.",
          "format": "direto",
          "discipline": "Direito Constitucional",
          "point_source": null
        }
      ]
    },
    {
      "id": "15",
      "status": "valida",
      "reviews": [
        {
          "id": "draft-15",
          "reviewer": "Codex — rascunho automatizado, não humano",
          "date": "2026-10-03",
          "note": "Página 7, coluna 1. Formato por heurística; disciplina por cabeçalho. Origem do ponto/dificuldade e classificação final aguardam revisão humana, portanto item não elegível.",
          "format": "direto",
          "discipline": "Direito Constitucional",
          "point_source": null
        }
      ]
    },
    {
      "id": "16",
      "status": "valida",
      "reviews": [
        {
          "id": "draft-16",
          "reviewer": "Codex — rascunho automatizado, não humano",
          "date": "2026-10-03",
          "note": "Página 7, coluna 2. Formato por heurística; disciplina por cabeçalho. Origem do ponto/dificuldade e classificação final aguardam revisão humana, portanto item não elegível.",
          "format": "numerado",
          "discipline": "Direito Constitucional",
          "point_source": null
        }
      ]
    },
    {
      "id": "17",
      "status": "valida",
      "reviews": [
        {
          "id": "draft-17",
          "reviewer": "Codex — rascunho automatizado, não humano",
          "date": "2026-10-03",